{"title":"把一公里，重新还给日常","audience":"社区营造与城市设计团队","scenario":"叙事型观察报告","tone":"典雅、克制、长篇编辑节奏","theme":"premium-editorial","imageCapabilityMode":"upload-slots","features":{"gesture":"off","presenterMode":true,"editable":true},"slides":[{"role":"cover","title":"把一公里，重新还给日常","layout":"editorial-cover","theme":"premium-editorial","visibleContent":{"lead":"一座社区的慢行叙事与微小改造"},"speakerNotes":"数字均为演示数据。"},{"role":"prologue","title":"一公里并不远，为什么仍然令人疲惫？","layout":"editorial-intro","theme":"premium-editorial","visibleContent":{"argument":"距离只是地图上的刻度。"},"speakerNotes":"从体感问题进入。"},{"role":"chapter","title":"先看见，才谈改变。","layout":"chapter","theme":"premium-editorial","visibleContent":{"number":"01","label":"OBSERVE"},"speakerNotes":"章节停顿。"},{"role":"journey","title":"沿途的五个瞬间，决定一次步行是否愿意重复。","layout":"editorial-timeline","theme":"premium-editorial","visibleContent":{"moments":["起","望","停","过","归"]},"speakerNotes":"路径记录。"},{"role":"evidence","title":"不是所有改造都需要很大，但每一处都要有依据。","layout":"editorial-table","theme":"premium-editorial","visibleContent":{"rows":["西侧转角","小广场边","学校路口"]},"speakerNotes":"田野账本。"},{"role":"chapter","title":"让变化连续发生。","layout":"chapter","theme":"premium-editorial","visibleContent":{"number":"02","label":"COMPOSE"},"speakerNotes":"转入组合动作。"},{"role":"mechanism","title":"三种微小介入，形成一条可感知的慢行线。","layout":"editorial-flow","theme":"premium-editorial","visibleContent":{"nodes":["识别","停留","守护"]},"speakerNotes":"三节点结构。"},{"role":"closing","title":"让每一次步行，\n都回到从容的日常。","layout":"editorial-closing","theme":"premium-editorial","visibleContent":{"title":"让每一次步行，\n都回到从容的日常。","lead":"从一段真实路径开始，把观察变成共同的微小改变。","next":"完成一次傍晚与夜晚的共同观察。"},"speakerNotes":"收束行动。"}]}
