{"title":"把夜间服务\n做成连续的城市体验","audience":"城市运营与服务协同团队","scenario":"策略工作坊","tone":"答案优先、紧凑证据、咨询简报","theme":"premium-consulting","imageCapabilityMode":"upload-slots","features":{"gesture":"off","presenterMode":true,"editable":true},"slides":[{"role":"cover","title":"把夜间服务\n做成连续的城市体验","layout":"consult-cover","theme":"premium-consulting","visibleContent":{"kicker":"城市运营专题","title":"把夜间服务\n做成连续的城市体验","lead":"从需求高峰、供给协同到可验证的改善闭环","footer":"内部工作坊 · 2026 年 10 月"},"speakerNotes":"数字为演示数据。"},{"role":"thesis","title":"需求不是不足，而是服务在高峰时段断开了。","layout":"answer-first","theme":"premium-consulting","visibleContent":{"lead":"晚间 20:00 后，居民需要的是一组可衔接的服务，而不是更多孤立入口。","evidence":["48% 需求集中在通勤后两小时","31% 因信息不清而放弃出行","17% 需要跨两个以上服务环节"]},"speakerNotes":"先结论，后证据。"},{"role":"timeline","title":"高峰窗口只有四小时，协同应围绕这一窗口排班。","layout":"timeline","theme":"premium-consulting","visibleContent":{"times":["18:00 离开办公区","20:00 到达目的地","22:00 返程决策","00:00 尾段离场"]},"speakerNotes":"说明服务断点。"},{"role":"diagnosis","title":"三个断点决定了体验是否连贯。","layout":"matrix","theme":"premium-consulting","visibleContent":{"axes":["可达","可见","可预期"]},"speakerNotes":"红色单元格是优先项。"},{"role":"priorities","title":"先修复信息与接驳，再扩大供给规模。","layout":"priorities","theme":"premium-consulting","visibleContent":{"actions":["72h 建立状态看板","2周 联动排班","6周 完整复盘"]},"speakerNotes":"按可验证速度排序。"},{"role":"process","title":"用四步试点把协同从会议变成日常机制。","layout":"steps","theme":"premium-consulting","visibleContent":{"steps":["选窗口","对状态","联排班","验体验"]},"speakerNotes":"可编辑的 HTML 流程。"},{"role":"measurement","title":"把更好拆成用户能感知的三类指标。","layout":"table","theme":"premium-consulting","visibleContent":{"metrics":["末段成功接驳率 62% 至 75%","状态信息命中率 54% 至 80%","等待偏差 12 分钟至 7 分钟"]},"speakerNotes":"按窗口汇总。"},{"role":"closing","title":"确认一个窗口，启动一次可验证的协同。","layout":"closing","theme":"premium-consulting","visibleContent":{"request":"试点地点、联合负责人、首周指标。"},"speakerNotes":"确认三项资源。"}]}
